{
  "id": "contract-manifest-block-01",
  "contract_version": "0.1.0",
  "signing_profile": "sdp-trace-signature/sigstore-dsse-keyless-v1",
  "schema_versions": [
    {
      "schema_id": "https://schemas.sdp.dev/trace/accountability.schema.json",
      "schema_version": "0.1.0"
    },
    {
      "schema_id": "https://schemas.sdp.dev/trace/assessment-input.schema.json",
      "schema_version": "0.1.0"
    },
    {
      "schema_id": "https://schemas.sdp.dev/trace/common.schema.json",
      "schema_version": "0.1.0"
    },
    {
      "schema_id": "https://schemas.sdp.dev/trace/consumer-schema-version-declaration.schema.json",
      "schema_version": "0.1.0"
    },
    {
      "schema_id": "https://schemas.sdp.dev/trace/contract-manifest.schema.json",
      "schema_version": "0.1.0"
    },
    {
      "schema_id": "https://schemas.sdp.dev/trace/contract-release-verification.schema.json",
      "schema_version": "0.1.0"
    },
    {
      "schema_id": "https://schemas.sdp.dev/trace/evidence-event.schema.json",
      "schema_version": "0.1.0"
    },
    {
      "schema_id": "https://schemas.sdp.dev/trace/external-verdict-input.schema.json",
      "schema_version": "0.1.0"
    },
    {
      "schema_id": "https://schemas.sdp.dev/trace/metric-stream.schema.json",
      "schema_version": "0.1.0"
    },
    {
      "schema_id": "https://schemas.sdp.dev/trace/observation.schema.json",
      "schema_version": "0.1.0"
    },
    {
      "schema_id": "https://schemas.sdp.dev/trace/provenance-record.schema.json",
      "schema_version": "0.1.0"
    },
    {
      "schema_id": "https://schemas.sdp.dev/trace/risk-classification.schema.json",
      "schema_version": "0.1.0"
    },
    {
      "schema_id": "https://schemas.sdp.dev/trace/trace.schema.json",
      "schema_version": "0.1.0"
    },
    {
      "schema_id": "https://schemas.sdp.dev/trace/trusted-identity-policy.schema.json",
      "schema_version": "0.1.0"
    }
  ],
  "artifacts": [
    {
      "path": "docs/accountability-model.md",
      "kind": "doc",
      "sha256": "214e53273c4d4dc3533f9a1551cdb671253f3b14b598020d5c6d122b9a43e599"
    },
    {
      "path": "docs/concepts.md",
      "kind": "doc",
      "sha256": "f1462307a9463f4df0289656ba5ce7a5d6dd8ceee40e36eaa06ee6646d80733e"
    },
    {
      "path": "docs/contract-release-signing.md",
      "kind": "doc",
      "sha256": "343b30cad6bec7482b98222f9f051348f0265b1bdf8d9e5bed987b5df9fe16dc"
    },
    {
      "path": "docs/cto-brief.en.md",
      "kind": "doc",
      "sha256": "ea47adb962eea9d718e79b88c67df4f364234d7e8c1d41f529ab3fe569879eb1"
    },
    {
      "path": "docs/cto-brief.ru.md",
      "kind": "doc",
      "sha256": "195c1db7e6509de7d79d5f4a0cf901e2b5c285c0f7d1c251ac764de72f7bd57a"
    },
    {
      "path": "docs/harness-compatibility-matrix.md",
      "kind": "compatibility_note",
      "sha256": "a181ec960dac654ceee42eef02f96b975c2e53d677c3b2fc27faaa6295a2f212"
    },
    {
      "path": "docs/jvm-bazel-guide.md",
      "kind": "doc",
      "sha256": "eddc853223d353a271a10e416b7a7cc07d25f2d87c6ca088dcac96540553bec8"
    },
    {
      "path": "docs/model-compatibility.md",
      "kind": "compatibility_note",
      "sha256": "d38e9b001b507bc5c66b395f07f0d2df95bfbfaba039b1775cb6ef281803e0ca"
    },
    {
      "path": "docs/research/customer-pilot-evidence-package.md",
      "kind": "doc",
      "sha256": "2bdb7277728182e7c75300c79b2f2cc44d6430d83a1ac611515d35f9c44e7cb0"
    },
    {
      "path": "docs/research/harness-run-card.md",
      "kind": "doc",
      "sha256": "44fdd1255bdb3d8bf6741818b06f09d441c1bb551b364947aa6de25318133cfc"
    },
    {
      "path": "docs/research/kotlin-bazel-fixture-plan.md",
      "kind": "doc",
      "sha256": "0ba0a00d7f6c9afb90cff54c436e7bd5a18f1f5f54496c7346c2ac224a2ad3c2"
    },
    {
      "path": "docs/research/opencode-model-run-card.md",
      "kind": "doc",
      "sha256": "d972e0698ec68f619111c1b9475a1391e7c0adbca08c01b18620c4597544fa4c"
    },
    {
      "path": "docs/research/run-card-template.md",
      "kind": "doc",
      "sha256": "ebf285497630528ec57b3cdd13e3f81b737a3951d4d7c32c20b78e20ae7382bc"
    },
    {
      "path": "docs/research/self-attestation-summary.md",
      "kind": "doc",
      "sha256": "72d823a844fa59a387318cbade49741e810b248f5799b4d8194ab5616fe9ae2c"
    },
    {
      "path": "docs/speckit-compatibility.md",
      "kind": "compatibility_note",
      "sha256": "d1503f280289c63a5a35c42efba9392a0e7a7b5f6cb3b31dedcb1e560610006a"
    },
    {
      "path": "docs/team-lead-playbook.en.md",
      "kind": "doc",
      "sha256": "232eb5e37064429655402ff5e4b0d46fba9f11e2ae212131765672504c24e712"
    },
    {
      "path": "docs/team-lead-playbook.ru.md",
      "kind": "doc",
      "sha256": "f6d4f08c5413939e01eb15263e8303a1dfe8f86743957743a9b6d716da97b4b5"
    },
    {
      "path": "examples/contract-foundation/local-dev-wrong-public.pem",
      "kind": "fixture",
      "sha256": "e6e4f0995aaa9420a21a22d213576fdd8a8ddd67ceb45c5843388bdb39c220a6"
    },
    {
      "path": "examples/contract-foundation/negative-ai-sole-accountable-owner.json",
      "kind": "fixture",
      "sha256": "99347a0a15e7a2fa04c0b65998ed921f31a5b94452e3a32788b897076f75d71d"
    },
    {
      "path": "examples/contract-foundation/negative-assessed-metric-without-evidence.json",
      "kind": "fixture",
      "sha256": "867803b017ca307abd094b90c0b060aacd504e9e574a563dc799b29b9bfdbb10"
    },
    {
      "path": "examples/contract-foundation/negative-modified-contract-manifest.json",
      "kind": "fixture",
      "sha256": "dbec89f9b1d498f6b3fd8ceb66f04435206a94f67baae288d9cb262fe730c352"
    },
    {
      "path": "examples/contract-foundation/negative-native-policy-field.json",
      "kind": "fixture",
      "sha256": "f1372a30df6185cc7094581e98c12fbcba215e9bdc676aee7e8a51ebc2455c3a"
    },
    {
      "path": "examples/contract-foundation/negative-native-policy-trace.json",
      "kind": "fixture",
      "sha256": "e4d651cf11760171ae48ad80941de1fd35b6a33dc7a2b3549b21a59ee5c566bc"
    },
    {
      "path": "examples/contract-foundation/not-assessed-assessment-input.json",
      "kind": "fixture",
      "sha256": "53fcaa0d3f1700d705d4538fc0d0b016b9dfdb2e28ebbc42cb65b86e4f50c085"
    },
    {
      "path": "examples/contract-foundation/positive-assessment-input.json",
      "kind": "fixture",
      "sha256": "c7fd277e256f6c66b9209c29943f2f90f68250abd77c2e9f911edcd9a1bc0197"
    },
    {
      "path": "examples/contract-foundation/sdp-gate-consumer-declaration.example.json",
      "kind": "fixture",
      "sha256": "a51d5a81a47e9bf4cfbd57a1b28ef40ea1e99cd2030e962c5a7bb3ee7e041665"
    },
    {
      "path": "examples/contract-foundation/trusted-identity-policy-wrong-profile.example.json",
      "kind": "fixture",
      "sha256": "1a5c42efdcc65c6fc290433d35dcd689fc4b103fb755e8e7a8934de30b3ffcdd"
    },
    {
      "path": "examples/contract-foundation/trusted-identity-policy.example.json",
      "kind": "fixture",
      "sha256": "b5973baa6c343ba2e4d56e285b9dc0a96dc6babc0fd47fb0d51f36b8fc5ec007"
    },
    {
      "path": "examples/github-speckit/trace.json",
      "kind": "fixture",
      "sha256": "df572053ce038540bb61dc3ad0e4f4a8b8e66025f8ec26f52bedfdd4ccbeafbc"
    },
    {
      "path": "examples/go-service/evidence-bundle.json",
      "kind": "fixture",
      "sha256": "0cc2a4ba8d8b5fbc34738b86fc717f6e85df1c39dc715d990d6592d3fda1f966"
    },
    {
      "path": "examples/go-service/gate-verdict.json",
      "kind": "fixture",
      "sha256": "4043936f06c05441fc6124f8d198baac6ed3071ace3977d3e4c2d5f1f2133d28"
    },
    {
      "path": "examples/jvm-bazel/evidence-bundle.json",
      "kind": "fixture",
      "sha256": "ca8aa3ee30dc7fc2121b7f017a73820c409a29c7bfd0b5c56eeb7fea2bacdec6"
    },
    {
      "path": "examples/jvm-bazel/README.md",
      "kind": "doc",
      "sha256": "e1120b5442b50f35f2e687684f4555cfc986d0a8378ac9ccaee1c51c81032273"
    },
    {
      "path": "package-lock.json",
      "kind": "validation_script",
      "sha256": "98c5924aafbd83ca39b1699696e13f148a949352c1e881cc6f94e71b0964079f"
    },
    {
      "path": "package.json",
      "kind": "validation_script",
      "sha256": "1ed64eed9d53f956a0055891ad78f97827dfc23f54d72384ca257630468f2e56"
    },
    {
      "path": "README.md",
      "kind": "doc",
      "sha256": "d1be265be5c6749ddf6a730cb9695a8ef0f692d7c4e99032f7df8ac4f0ec98bf"
    },
    {
      "path": "schema/accountability.schema.json",
      "kind": "schema",
      "sha256": "6d7c865a0a875437aa24f687e2cc3cf9a738e8f7fce911b21b103bb413521f62"
    },
    {
      "path": "schema/assessment-input.schema.json",
      "kind": "schema",
      "sha256": "0f7dbc1c32366b59ec5fa8f61a1ffd7551ad1c7baf529bdfec05f424eff9dada"
    },
    {
      "path": "schema/common.schema.json",
      "kind": "schema",
      "sha256": "025a1c4e0a5fe5974e16b66a7c54a26da18c5fc6fa051ddcac8f82e74274a3e8"
    },
    {
      "path": "schema/consumer-schema-version-declaration.schema.json",
      "kind": "schema",
      "sha256": "e1a5c891179cb8c0217839724d8af1a67d4eda84e15ba43f5eb788e812ba4f3b"
    },
    {
      "path": "schema/contract-manifest.schema.json",
      "kind": "schema",
      "sha256": "0b8ded3564f934807fa55b624af6ac4f7e4bd6978114ddb5145d868fbf834759"
    },
    {
      "path": "schema/contract-release-verification.schema.json",
      "kind": "schema",
      "sha256": "e36f3f6833bc244d32f54967d0f0e155990d891557a4785afdc47984ce129b77"
    },
    {
      "path": "schema/evidence-bundle.schema.json",
      "kind": "schema",
      "sha256": "9c4de49b7a4a40e73fb1cab087a5ce72fce4b593921cae5856ca848bf7109228"
    },
    {
      "path": "schema/evidence-event.schema.json",
      "kind": "schema",
      "sha256": "451b5526a3c5d7e6b7c574d1ff1c5d929325f19fe24c529924ffdcf998b8ae0a"
    },
    {
      "path": "schema/external-verdict-input.schema.json",
      "kind": "schema",